Question,Answer
길라잡이 36단계 이후로도 마을 청크를 확장하는 미션이 존재하나요?,마을 청크를 확장하는 미션은 더 이상 없지만 마을 자재 점수를 채우는 미션이 존재합니다.
영혼의 원소가루 어디에 사용하나요?,추후 원소 업데이트 후에 사용처가 추가될 예정이니 모으고 계시는 것을 추천드립니다.
일일랭킹 점수는 언제부터 얻을 수 있나요?,길라잡이 40단계 이후부터 얻을 수 있습니다.
일일랭킹 점수는 어떻게 얻나요?,"흙 파기, 돌 캐기 등 /스킬 과 관련된 행동을 하실 때 1%의 확률로 1점씩 얻을 수 있으며 레이드, 낚시대회 참여, 보물상자 발견 등을 통해서도 얻을 수 있습니다."
왜 레이드를 클리어 했는데도 길라잡이 클리어가 안되나요?,레이드에서 막타를 치셔야 클리어 횟수로 인정됩니다.
잠수는 어떻게 하나요?,/서버이동 > 로비서버 > 네더의 별 우클릭 > 잠수전투 로 이동하셔서 잠수하시면 됩니다.
마을월드에서 치장이 안보여요,현재 렉 유발로 스폰서버에서만 치장이 보이게 설정 됐습니다.
원소는 어떻게 얻나요?,"땅의 원소= 발굴, 채광 / 불의 원소= 농사 / 바람 원소= 벌목 / 물 원소= 낚시 / 영혼 원소= 전투 에서 얻을 수 있습니다."
원소는 어디에 쓰나요?,"땅의 원소 길라잡이 45단계 후 마을확장 건축자재로 사용 가능하며, 나머지 원소들은 추가 컨텐츠 업데이트 예정입니다."
길라잡이 47단계는 어떻게 깨죠?,"치장품을 뽑으시면 됩니다. 치장품은 영웅 열쇠로 뽑을 수 있으며, 스폰 > 루비상점에서 뽑으실 수 있습니다."
잠수코인을 베어코인으로 어떻게 교환하죠?,잠수서버에 알레이 잠수메뉴 > 베어코인으로 교환을 누르시면 교환이 가능합니다.
길라잡이하는데 청크점유가 안돼요,이미 땅이 있으시다면 금호미 없이 원하는 청크에 서서 /마을 점유로 땅을 늘리실 수 있습니다.
길라잡이하는데 청크점유를 어떻게 하죠?,이미 땅이 있으시다면 금호미 없이 원하는 청크에 서서 /마을 점유로 땅을 늘리실 수 있습니다.
위더 소환해도 되나요?,"위더 소환이 가능하고, 엔더 드래곤을 부활시키는 것도 가능합니다. (네더의 별은 상점 > 전리품에도 판매되고 있습니다.)"
엔더 드레곤 소환해도 되나요?,"위더 소환이 가능하고, 엔더 드래곤을 부활시키는 것도 가능합니다. (네더의 별은 상점 > 전리품에도 판매되고 있습니다.)"
펫 기간제인가요?,처음 뽑은 펫은 기간제가 아닙니다. 중복된 펫일 경우 루비 1개와 3일 쿠폰이 나옵니다. 
펫 해제 어떻게 해요?,펫 해제는 펫을향해서 쉬프트+우클릭 > 펫 아이콘 누르시면 됩니다.
액티브 스킬을 사용하면 일일퀘스트 (일퀘)의 카운팅이 되나요?/액티브 스킬을 사용하면 주간퀘스트 (주간퀘)의 카운팅이 되나요?,"액티브 스킬(발굴, 벌목 등)로 파괴 시 함께 파괴되는 블록들은 일,주간퀘스트에 카운팅 되지 않습니다. 허나 스킬 경험치는 오릅니다."
엔더 드래곤 어떻게 살려요?,엔드수정을 엔더월드 중앙에 동서남북으로 설치하면 엔더드래곤을 되살릴수있습니다.
잠수 전투가 뭐에요?,로비 서버에서 /afk 하시면 잠수 전투를 시작하실 수 있으시며 잠수 전투로 얻은 화폐는 베어 코인으로 교환하거나 각종 강화가 가능합니다.
동물 어떻게 데려가요?,"포획허가서가 필요하며, 커스텀 동물들은 데려갈 수 없습니다."
몬스터 볼 어떻게 쓰나요?,"포획허가서가 필요하며, 커스텀 동물들은 데려갈 수 없습니다."
디스코드 연동코드가 안 나와요,스폰 서버에서 /디스코드 연동 를 하면 됩니다.
마을 스폰장소 어떻게 바꾸나요?,마을 안에서 /마을 스폰설정 을 통해 변경할 수 있습니다.
비닐하우스 한 개로 여러 개의 작물을 보호할 수 있나요?,비닐하우스 한 개 당 한 개의 커스텀 작물만 보호할 수 있습니다.
수선 책 어디서 사나요?,"/상점 > 기타아이템 상점 , /경매장 , 유저에게서 구매 가능합니다."
어부 레벨이 모자라도 다른 유저에게 미끼를 구매해서 사용이 가능한가요?,"네, 미끼 사용과 어부 레벨은 무관합니다."
물방울 모양은 뭔가요?,/스킬 중에서 액티브 스킬을 사용할 때 필요한 수치인 마나입니다.
위더 마을에서 잡아도 되나요?,야생서버에서 잡는 것을 권장드립니다.
바닐라 음식 말고도 달걀이 쓰이는 곳이 있나요?,커스텀 요리를 할 때 재료로 사용됩니다.
커스텀 요리는 어떻게 하나요?,"/스폰 > 우측 버스정류장 > 가구상점 에서 요리기구(오븐, 믹서기, 반죽기 등)를 구매하면 됩니다."
마을은 어떻게 지우나요?,/마을 삭제 를 입력하면 됩니다.
전투력은 어떻게 올리나요?,"갑옷, 무기의 바닐라 인챈트 갯수, 무기의 공격력, 스탯, 힘버프 등에 영향을 받습니다."
높은 등급의 물뿌리개는 어떻게 얻나요?,/스폰 > 우측 버스정류장 > 하버의 농작물상점의 npc에게 교환할 수 있습니다.
커스텀 농작물이 다 자란 상태여도 계절이 지나면 썩나요?,커스텀 농작물이 1단계라도 성장 했다면 계절이 지나도 썩지 않습니다.
길라잡이 16단계 진행도가 -1인데 왜 이러나요?,마을월드에서 다시 시도하시면 됩니다.
야생서버마다 네더월드가 다른가요?,"네, 각 야생서버마다 네더월드가 별개로 존재합니다."
야생서버마다 엔더월드가 다른가요?,"네, 각 야생서버마다 엔더월드가 별개로 존재합니다."
랜덤 텔포 어떻게 하나요?,/wild 를 통해 랜덤텔포가 가능합니다.
마을월드에서 네더포탈을 탈 수 있나요?,"아니오, 마을월드에서 네더포탈 생성은 가능하지만 이용은 불가능합니다."
허수아비는 어디에 설치해야 하나요?,보호하고자 하는 청크 안 아무데나 설치해도 됩니다.
바닐라 경험치는 어디에 사용하나요?,마법부여대에서 인챈트를 하거나 /e 로 커스텀 인챈트 북을 뽑을 수 있습니다.
보물지도를 얻었는데 빈 지도인데 왜 이러나요?,마인크래프트 자체 오류로 빈 지도가 나오기도 합니다.
과성장 농작물은 도구로 캐야하나요?,맨손이나 도구로 블럭을 캐듯이 과성장 농작물을 캐시면 됩니다.
다른사람에게 어떻게 이동하나요?,/tpa 닉네임 를 통해 tp 요청이 가능합니다.
본인의 위치로 다른사람을 어떻게 이동시키나요?,/tpahere 닉네임 를 통해 tp 권유가 가능합니다.
커스텀 작물은 어디에 심나요?,/상점 > 농작물 상점 > 농사 도구 상점에서 화분을 구매 후 화분에 심으면 됩니다.
비닐하우스는 어디에 설치해야 하나요?,"보호할 화분과 같은 x, z 좌표 위에 햇빛을 가린다는 느낌으로 설치하면 됩니다."
야생에 몬스터가 안 나오나요?,서버의 몹 스폰률이 낮은편이기에 밤에 한 장소에 머무르거나 동굴에서 몬스터를 사냥하는 걸 추천드립니다.
광물은 어디서 구매하나요?,광물은 서버 상점에서 구매가 불가능하기에 유저한테 구매해야 합니다.
출석체크 어떻게 하나요?,출석체크는 접속보상으로 합일되었습니다.
광물 상점은 따로 없나요?,"/상점 > 광물, 서버 상점에서는 광물 구매가 불가합니다."
청크 어떻게 보나요?,f3+g 키를 통해서 청크를 볼 수 있습니다.
커스텀 작물 청크 당 몇 개 설치 가능한가요?,한 청크당 64개 까지의 커스텀 작물이 성장할 수 있습니다.
야생 초기화 언제 하나요?,약 2주마다 주기적으로 진행되고 진행 전 /디스코드 > 공지사항에 공지 됩니다.
나무 어디서 캐나요?,/wild 를 통해서 랜덤텔포 하면서 찾으시면 됩니다.
작물이 시들었대요,작물을 키울 수 있는 계절이 아니거나 물을 안 줘서 작물이 시든 상태입니다. 좌클릭으로 부수면 됩니다.
낚시대 어떻게 얻나요?,직접 제작하거나 유저에게 구매하면 됩니다.
길라잡이 1단계 어떻게 깨나요?,"/워프 > 야생월드 를 통해 이동 후, /wild 를 통해 랜덤텔포 하면서 나무를 캐면 됩니다."
옵티파인을 설치하고 횃불을 들었는데도 주변이 어두워요,esc > 비디오설정 > 동적조명 on 하시면 됩니다.
과성장 농작물은 어떻게 얻나요?,비료를 사용하지 않을 경우 커스텀 농작물이 완전히 성장할 때 1% 확률로 과성장 농작물이 나옵니다.
화분에 물은 어느 주기로 줘야 하나요?,화분은 마인크래프트 시간으로 정각(20분 간격)에 마르므로 그 이후에 물을 주시면 됩니다.
채팅창 크기를 줄일 수 있는 방법은 없나요?,esc > 비디오설정 > gui크기설정 에서 조절할 수 있습니다.
비닐하우스 어떻게 설치해요?,보호할 작물과 같은 좌표 위에 햇빛을 가린다는 느낌으로 설치하면 됩니다.
비닐 하우스는 화분 위에만 있으면 되는건가요?,보호할 작물과 같은 좌표 위에 햇빛을 가린다는 느낌으로 설치하면 됩니다.
스프링쿨러 업글 방법 아시는분 있나요?,/스폰 > 우측 버스정류장 > 하버의 농작물상점의 npc에게 교환할 수 있습니다.
물뿌리개 강화 같은거 가능한가요?,/스폰 > 우측 버스정류장 > 하버의 농작물상점의 npc에게 교환할 수 있습니다.
물뿌리개 업그레이드 어떻게 해요?,/스폰 > 우측 버스정류장 > 하버의 농작물상점의 npc에게 교환할 수 있습니다.
물뿌리개랑 스프링쿨러 구리 이상으로 좋은 거는 어디서 사나용,/스폰 > 우측 버스정류장 > 하버의 농작물상점의 npc에게 교환할 수 있습니다.
상급 스프링쿨러는 어디서 구매할 수 있을까요?,/스폰 > 우측 버스정류장 > 하버의 농작물상점의 npc에게 교환할 수 있습니다.
스프링쿨러가 왜 설치가 안되나요?,한 청크당 64개 까지의 커스텀 작물이 성장할 수 있습니다.
커작 화분은 64개 밖에 못 쓰나요?,한 청크당 64개 까지의 커스텀 작물이 성장할 수 있습니다.
농작물 제한 걸려서 안 심어지는데 어떻게 하나요?,한 청크당 64개 까지의 커스텀 작물이 성장할 수 있습니다.
커스텀 농작물에 제한이 있나요?,한 청크당 64개 까지의 커스텀 작물이 성장할 수 있습니다.
마을에 돈 어떻게 넣나요?,/마을 예금 금액 를 통해 마을 금고에 돈을 추가 할 수 있습니다.
마을 유지비 어디에 내나요?,/마을 예금 금액 를 통해 마을 금고에 돈을 추가 할 수 있습니다.
길라잡이 16단계 돈이 없으면 못하나요?,/마을 예금 금액 를 통해 마을 금고에 돈을 추가 할 수 있습니다.
마을 세금내는거 어떻게 하나요?,/마을 예금 금액 를 통해 마을 금고에 돈을 추가 할 수 있습니다.
커농 다 자란 모습도 위키에 적혀있나요?,/위키 > 메인컨텐츠 > 생활활동 > 커스텀농작물 부분 내용을 참고하시면 됩니다.
용과 씨앗은 어떻게 심나요 모르겠어요,/위키 > 메인컨텐츠 > 생활활동 > 커스텀농작물 부분 내용을 참고하시면 됩니다.
고급과성장 쓰면 몇퍼인가요?,/위키 > 메인컨텐츠 > 생활활동 > 커스텀농작물 부분 내용을 참고하시면 됩니다.
스프링쿨러 어떻게 쓰나요?,/위키 > 메인컨텐츠 > 생활활동 > 커스텀농작물 부분 내용을 참고하시면 됩니다.
꿀은 어디에 쓰이길래 많이들 구하는걸까용?,"[/상점 > 꿀 상점, 하버의 농작물 상점], [/e > 마법 상점], [/스폰 > 우측버스정류장 > 가구 상점, 악기 상점] 등에서 각종 아이템을 구매하는데 사용합니다."
꿀은 어떻게 얻나요?,"일일랭킹, 길라잡이, 레이드, 과성장 농작물 등을 통해서 얻을 수 있습니다."
꿀은 어디서 얻나요?,"일일랭킹, 길라잡이, 레이드, 과성장 농작물 등을 통해서 얻을 수 있습니다."
현재 서버에서 꿀을 얻을 수단이 상자깡 밖에 없는게 맞나요?,"일일랭킹, 길라잡이, 레이드, 과성장 농작물 등을 통해서 얻을 수 있습니다."
꿀 어따 쓰죠?,"[/상점 > 꿀 상점, 하버의 농작물 상점], [/e > 마법 상점], [/스폰 > 우측버스정류장 > 가구 상점, 악기 상점] 등에서 각종 아이템을 구매하는데 사용합니다."
꿀은 어디에 사용할 수 있나요?,"[/상점 > 꿀 상점, 하버의 농작물 상점], [/e > 마법 상점], [/스폰 > 우측버스정류장 > 가구 상점, 악기 상점] 등에서 각종 아이템을 구매하는데 사용합니다."
꿀이 뭔가요?,서버 내 존재하는 재화의 종류 중 하나 입니다.
로얄젤리가 뭔가요?,서버 내 존재하는 재화의 종류 중 하나 입니다.
코인이 뭔가요?,서버 내 존재하는 재화의 종류 중 하나 입니다.
베어코인이 뭔가요?,서버 내 존재하는 재화의 종류 중 하나 입니다.
꿀은 어디에 사용하나요?,"[/상점 > 꿀 상점, 하버의 농작물 상점], [/e > 마법 상점], [/스폰 > 우측버스정류장 > 가구 상점, 악기 상점] 등에서 각종 아이템을 구매하는데 사용합니다."
발굴 레벨 어떻게올리나요?,/스킬 > 해당 스킬 > 돋보기 아이콘에서 자세한 경험치 획득법 및 경험치량을 볼 수 있습니다.
농사 스킬 어떻게 올려요?,/스킬 > 해당 스킬 > 돋보기 아이콘에서 자세한 경험치 획득법 및 경험치량을 볼 수 있습니다.
사탕수수로 농사 레벨이 올라요?,/스킬 > 해당 스킬 > 돋보기 아이콘에서 자세한 경험치 획득법 및 경험치량을 볼 수 있습니다.
제가 만든 마을로 워프하려면 어떻게 해야하나요?,본인의 마을이 있는 월드에서 /마을 스폰 를 통해 마을로 이동할 수 있습니다.
자기 집으로는 다시 어떻게 오나요?,본인의 마을이 있는 월드에서 /마을 스폰 를 통해 마을로 이동할 수 있습니다.
님들 가방 어떻게 써요?,길라잡이 40단계 이후로 가방1줄(9칸)씩 사용이 가능하고 60단계 까지 클리어할 경우 3줄(27칸) 사용 가능합니다.
가방 명령어 길라잡이 몇랩때 열리나요?,길라잡이 40단계 이후로 가방1줄(9칸)씩 사용이 가능하고 60단계 까지 클리어할 경우 3줄(27칸) 사용 가능합니다.
가방은 어떻게 사용하죠,길라잡이 40단계 이후로 가방1줄(9칸)씩 사용이 가능하고 60단계 까지 클리어할 경우 3줄(27칸) 사용 가능합니다.
/가방 명령어는 언제 사용 가능한가요?,길라잡이 40단계 이후로 가방1줄(9칸)씩 사용이 가능하고 60단계 까지 클리어할 경우 3줄(27칸) 사용 가능합니다.
스프링쿨러 업그레이드는 어떻게 하나요?,/스폰 > 우측 버스정류장 > 하버의 농작물상점의 npc에게 교환할 수 있습니다.
꿀은 어디서 얻어요?,"일일랭킹, 길라잡이, 레이드, 과성장 농작물 등을 통해서 얻을 수 있습니다."
발굴은 흙 파야돼요?,/스킬 > 해당 스킬 > 돋보기 아이콘에서 자세한 경험치 획득법 및 경험치량을 볼 수 있습니다.
제 마을은 어떻게 가나요?,본인의 마을이 있는 월드에서 /마을 스폰 를 통해 마을로 이동할 수 있습니다.
집 어떻게 짓나요?,마을월드에서 /마을 생성 마을이름 를 입력하면 됩니다.
땅에 권한이 없대요,마을월드에서 /마을 생성 마을이름 를 입력하면 됩니다.
마을 어떻게 만드나요?,마을월드에서 /마을 생성 마을이름 를 입력하면 됩니다.
상자 못놔요?,마을월드에서 /마을 생성 마을이름 를 입력하면 됩니다.
농사 어디서 지어요?,마을월드에서 /마을 생성 마을이름 를 입력하면 됩니다.
마을 땅이 안캐져요,마을월드에서 /마을 생성 마을이름 를 입력하면 됩니다.
황무지인데 안캐져요,마을월드에서 /마을 생성 마을이름 를 입력하면 됩니다.
마을은 어디다가 생성해요?,마을월드에서 /마을 생성 마을이름 를 입력하면 됩니다.
허수아비 기능이 뭔가요?,허수아비가 설치된 청크의 커스텀 농작물들은 씨앗을 훔쳐가는 까마귀로부터 보호가 가능합니다.
허수아비 어디에 쓰나요?,허수아비가 설치된 청크의 커스텀 농작물들은 씨앗을 훔쳐가는 까마귀로부터 보호가 가능합니다.
허수아비가 뭔가요?,허수아비가 설치된 청크의 커스텀 농작물들은 씨앗을 훔쳐가는 까마귀로부터 보호가 가능합니다.
허수아비는 어디다가 설치해요?,허수아비가 설치된 청크의 커스텀 농작물들은 씨앗을 훔쳐가는 까마귀로부터 보호가 가능합니다.
허수아비 얼만큼 돼요?,허수아비가 설치된 청크의 커스텀 농작물들은 씨앗을 훔쳐가는 까마귀로부터 보호가 가능합니다.
허수아비 범위가 어느정도에요?,허수아비가 설치된 청크의 커스텀 농작물들은 씨앗을 훔쳐가는 까마귀로부터 보호가 가능합니다.
길라잡이 16단계 어떻게 해야하나요?,기존에 구매한 마을청크 옆의 황무지 청크에서 /claim 를 통해 마을 청크를 추가로 구매하면 됩니다.
길라잡이 16단계 어떻게 깨나요?,기존에 구매한 마을청크 옆의 황무지 청크에서 /claim 를 통해 마을 청크를 추가로 구매하면 됩니다.
길라잡이 16단계 마을 확장을 해야 하나요?,기존에 구매한 마을청크 옆의 황무지 청크에서 /claim 를 통해 마을 청크를 추가로 구매하면 됩니다.
마을 어떻게 확장 하나요?,기존에 구매한 마을청크 옆의 황무지 청크에서 /claim 를 통해 마을 청크를 추가로 구매하면 됩니다.
마을 어떻게 키워요?,기존에 구매한 마을청크 옆의 황무지 청크에서 /claim 를 통해 마을 청크를 추가로 구매하면 됩니다.
땅 어떻게 사요?,기존에 구매한 마을청크 옆의 황무지 청크에서 /claim 를 통해 마을 청크를 추가로 구매하면 됩니다.
수직굴 파도 되나요?,"서버 규칙에서 수직굴을 제재하지는 않으나, 다른 유저들을 위하여 입구를 막아주시길 바랍니다.                                "
서버에서 수직굴 가능한가요?,"서버 규칙에서 수직굴을 제재하지는 않으나, 다른 유저들을 위하여 입구를 막아주시길 바랍니다.                                "
수직굴 해도 돼요?,"서버 규칙에서 수직굴을 제재하지는 않으나, 다른 유저들을 위하여 입구를 막아주시길 바랍니다.                                "
일자굴 파도 돼요?,"서버 규칙에서 수직굴을 제재하지는 않으나, 다른 유저들을 위하여 입구를 막아주시길 바랍니다.                                "
일자굴 해도 돼요?,"서버 규칙에서 수직굴을 제재하지는 않으나, 다른 유저들을 위하여 입구를 막아주시길 바랍니다.                                "
마을월드에 마을을 지을 공간이 안 보여요,랜덤 TP 명령어는 /wild 로 이용 가능합니다.
마을 어디다 짓나요?,랜덤 TP 명령어는 /wild 로 이용 가능합니다.
마을 월드 땅 속에 갇혔어요,랜덤 TP 명령어는 /wild 로 이용 가능합니다.
마을 월드 평지를 어디서 찾나요?,랜덤 TP 명령어는 /wild 로 이용 가능합니다.
야생 왔는데 나무가 안보여요,랜덤 TP 명령어는 /wild 로 이용 가능합니다.
악기는 어떻게 해요?,"/스폰 > 우측버스정류장 > 악기 상점에서 구매가 가능하며, vip유저들만 악기 연주가 가능합니다."
악기 어디서 사요?,"/스폰 > 우측버스정류장 > 악기 상점에서 구매가 가능하며, vip유저들만 악기 연주가 가능합니다."
피아노 어떻게 쳐요?,"/스폰 > 우측버스정류장 > 악기 상점에서 구매가 가능하며, vip유저들만 악기 연주가 가능합니다."
연주 어떻게 해요?,"/스폰 > 우측버스정류장 > 악기 상점에서 구매가 가능하며, vip유저들만 악기 연주가 가능합니다."
악기는 어디서 사나요?,"/스폰 > 우측버스정류장 > 악기 상점에서 구매가 가능하며, vip유저들만 악기 연주가 가능합니다."
플롯은 어떻게 연주하나요?,"/스폰 > 우측버스정류장 > 악기 상점에서 구매가 가능하며, vip유저들만 악기 연주가 가능합니다."
기타는 어떻게 연주하나요?,"/스폰 > 우측버스정류장 > 악기 상점에서 구매가 가능하며, vip유저들만 악기 연주가 가능합니다."
차임은 어떻게 연주하나요?,"/스폰 > 우측버스정류장 > 악기 상점에서 구매가 가능하며, vip유저들만 악기 연주가 가능합니다."
악기 연주는 어떻게 해요?,"/스폰 > 우측버스정류장 > 악기 상점에서 구매가 가능하며, vip유저들만 악기 연주가 가능합니다."
낚시는 어디서해요?,어디서나 물이 있는 곳에서 미끼를 장착한 상태로 낚시를 하면 커스텀 물고기를 낚을 수 있습니다.
마을에서 낚시해도 되나요?,어디서나 물이 있는 곳에서 미끼를 장착한 상태로 낚시를 하면 커스텀 물고기를 낚을 수 있습니다.
야생에서 낚시해도 되나요?,어디서나 물이 있는 곳에서 미끼를 장착한 상태로 낚시를 하면 커스텀 물고기를 낚을 수 있습니다.
야생 어떻게 가요?,/워프 > 오버월드 를 통해서 야생으로 이동할 수 있습니다.
나무 어디서 캐요?,/워프 > 오버월드 를 통해서 야생으로 이동할 수 있습니다.
동물은 어디서 잡아요?,/워프 > 오버월드 를 통해서 야생으로 이동할 수 있습니다.
물고기 손질이 왜 안되나요?,/어부 > 물고기 손질 은 커스텀 물고기만 가능합니다.
물고기 손질 어떻게 해요?,/어부 > 물고기 손질 은 커스텀 물고기만 가능합니다.
물고기 손질 안돼요,/어부 > 물고기 손질 은 커스텀 물고기만 가능합니다.
물고기 손질 눌러도 없대요,/어부 > 물고기 손질 은 커스텀 물고기만 가능합니다.
대구 올렸는데 환불됐어요,/어부 > 물고기 손질 은 커스텀 물고기만 가능합니다.
연어 올렸는데 환불됐어요,/어부 > 물고기 손질 은 커스텀 물고기만 가능합니다.
열대어는 손질이 안돼요?,/어부 > 물고기 손질 은 커스텀 물고기만 가능합니다.
복어는 손질 못하나요?,/어부 > 물고기 손질 은 커스텀 물고기만 가능합니다.
랜덤워프 명령어좀알려주실분 있나요?,랜덤 TP 명령어는 /wild 로 이용 가능합니다.
미끼 대리구매 해도 돼요?,미끼 상점에서 미끼 구매 시 레벨 제한이 존재하지만 미끼 사용 시 레벨 제한이 없습니다.
높은 등급 미끼 써도 되나요?,미끼 상점에서 미끼 구매 시 레벨 제한이 존재하지만 미끼 사용 시 레벨 제한이 없습니다.
어부 레벨 안되는데 높은 등급 미끼 써도 돼요?,미끼 상점에서 미끼 구매 시 레벨 제한이 존재하지만 미끼 사용 시 레벨 제한이 없습니다.
레벨 낮은데 황금새우 낄수있어요?,미끼 상점에서 미끼 구매 시 레벨 제한이 존재하지만 미끼 사용 시 레벨 제한이 없습니다.
로얄젤리 어따써요?,"/후원 에서 VIP 권한 구매, /후원상점 에서 아이템 구매, /보급상자 에서 커스텀 도구 열쇠 구매, 마을 건축자재 등에 사용됩니다."
로얄젤리 좋은거에요?,"/후원 에서 VIP 권한 구매, /후원상점 에서 아이템 구매, /보급상자 에서 커스텀 도구 열쇠 구매, 마을 건축자재 등에 사용됩니다."
사람들이 로얄젤리를 왜 사나요?,"/후원 에서 VIP 권한 구매, /후원상점 에서 아이템 구매, /보급상자 에서 커스텀 도구 열쇠 구매, 마을 건축자재 등에 사용됩니다."
"로얄젤리 구매하시는분 많던데, 주로 어디에 쓰시는건가요?","/후원 에서 VIP 권한 구매, /후원상점 에서 아이템 구매, /보급상자 에서 커스텀 도구 열쇠 구매, 마을 건축자재 등에 사용됩니다."
로얄젤리는 어떻게 얻어요?,"길라잡이, 유저거래, 경매장 등을 통해서 얻으시거나 후원을 통해서 1000원당 로얄젤리 1개를 얻을 수 있습니다."
젤리가 뭐죠?,서버 내 존재하는 재화의 종류 중 하나 입니다.
젤리 이건 뭐에요?,서버 내 존재하는 재화의 종류 중 하나 입니다.
돈을 어떻게 벌어요?,"농사, 광질, 낚시 등의 활동을 통해 돈을 벌 수 있습니다."
돈은 어떤게 잘 벌리나요?,"농사, 광질, 낚시 등의 활동을 통해 돈을 벌 수 있습니다."
돈 잘 버는법 있나요?,"농사, 광질, 낚시 등의 활동을 통해 돈을 벌 수 있습니다."
