Question,Answer
친구와 같이 상자를쓰고싶어요,"/cp 를 통해 상자 잠금, 잠금공유, 잠금해제 등의 설정을 할 수 있습니다."
상자 권한을 어떻게 주나요?,"/cp 를 통해 상자 잠금, 잠금공유, 잠금해제 등의 설정을 할 수 있습니다."
상자 권한 어떻게 푸나요?,"/cp 를 통해 상자 잠금, 잠금공유, 잠금해제 등의 설정을 할 수 있습니다."
제 상자를 마을원들이랑 같이쓸수없나요?,"/cp 를 통해 상자 잠금, 잠금공유, 잠금해제 등의 설정을 할 수 있습니다."
상자 잠금설정은 어떻게 하나요?,"/cp 를 통해 상자 잠금, 잠금공유, 잠금해제 등의 설정을 할 수 있습니다."
상자 권한 설정 할 수 있나요?,"/cp 를 통해 상자 잠금, 잠금공유, 잠금해제 등의 설정을 할 수 있습니다."
신화 물고기 낚이나요?,현재 신화 물고기는 준비중인 시스템이기에 낚이지 않습니다.
신화 물고기 어떻게 낚아요?,현재 신화 물고기는 준비중인 시스템이기에 낚이지 않습니다.
신화 물고기 파시는분 있나요?,현재 신화 물고기는 준비중인 시스템이기에 낚이지 않습니다.
마을서버가 꽉찼어요,현재 해당 서버의 인원이 가득 차 서버 입장이 안 되는 상황이기에 계속해서 접속시도를 하시다보면 접속할 수 있습니다.
마을1 꽉찼어요,현재 해당 서버의 인원이 가득 차 서버 입장이 안 되는 상황이기에 계속해서 접속시도를 하시다보면 접속할 수 있습니다.
마을2 꽉찼어요,현재 해당 서버의 인원이 가득 차 서버 입장이 안 되는 상황이기에 계속해서 접속시도를 하시다보면 접속할 수 있습니다.
마을3 꽉찼어요,현재 해당 서버의 인원이 가득 차 서버 입장이 안 되는 상황이기에 계속해서 접속시도를 하시다보면 접속할 수 있습니다.
야생이 꽉찼어요,현재 해당 서버의 인원이 가득 차 서버 입장이 안 되는 상황이기에 계속해서 접속시도를 하시다보면 접속할 수 있습니다.
마을서버 언제 갈 수 있나요?,현재 해당 서버의 인원이 가득 차 서버 입장이 안 되는 상황이기에 계속해서 접속시도를 하시다보면 접속할 수 있습니다.
마을이 안 가져요,현재 해당 서버의 인원이 가득 차 서버 입장이 안 되는 상황이기에 계속해서 접속시도를 하시다보면 접속할 수 있습니다.
사람 언제 빠져요?,현재 해당 서버의 인원이 가득 차 서버 입장이 안 되는 상황이기에 계속해서 접속시도를 하시다보면 접속할 수 있습니다.
스폰이 꽉찼어요,현재 해당 서버의 인원이 가득 차 서버 입장이 안 되는 상황이기에 계속해서 접속시도를 하시다보면 접속할 수 있습니다.
꿀이 안 팔려요,손에 아이템을 들고 /업데이트 를 해보시기 바랍니다.
로얄젤리가 안 팔려요,손에 아이템을 들고 /업데이트 를 해보시기 바랍니다.
코인이 안 팔려요,손에 아이템을 들고 /업데이트 를 해보시기 바랍니다.
상점에서 코인이 안 팔려요,손에 아이템을 들고 /업데이트 를 해보시기 바랍니다.
교환이 안 돼요,손에 아이템을 들고 /업데이트 를 해보시기 바랍니다.
원소가루가 안 합쳐져요,손에 아이템을 들고 /업데이트 를 해보시기 바랍니다.
아이템이 안 합쳐져요,손에 아이템을 들고 /업데이트 를 해보시기 바랍니다.
열쇠가 안 합쳐져요,손에 아이템을 들고 /업데이트 를 해보시기 바랍니다.
플라이권이 안 합쳐져요,손에 아이템을 들고 /업데이트 를 해보시기 바랍니다.
계절 언제 바뀌나요?,"계절은 봄, 여름, 가을, 겨울의 사게절이 있으며 각각 28일까지 존재합니다"
계절 며칠까지 있어요?,"계절은 봄, 여름, 가을, 겨울의 사게절이 있으며 각각 28일까지 존재합니다"
계절은 어디서 보나요,마을서버에서 우측 스코어보드 '달력' 을 보면 됩니다.
혹시 계절은 어떻게 알 수 있나요?,마을서버에서 우측 스코어보드 '달력' 을 보면 됩니다.
과성장 작물 확률 공개되어있나요?,비료를 사용하지 않을 경우 커스텀 농작물이 완전히 성장할 때 1% 확률로 과성장 농작물이 나옵니다.
과성장 농작물 어떻게 키우나요?,비료를 사용하지 않을 경우 커스텀 농작물이 완전히 성장할 때 1% 확률로 과성장 농작물이 나옵니다.
과성장 식물을 만드려면 다자란 식물을 캐면안되나요?,비료를 사용하지 않을 경우 커스텀 농작물이 완전히 성장할 때 1% 확률로 과성장 농작물이 나옵니다.
혹시 과성장 토마토도 1~4개 사이에서 드롭되나요?,과성장 농작물은 1개씩만 드랍됩니다.
과성장 토마토는 많이 나오나요?,과성장 농작물은 1개씩만 드랍됩니다.
과성장 작물은 그냥 맨손 왼클로 캐면되나용?,맨손이나 도구로 블럭을 캐듯이 과성장 농작물을 캐시면 됩니다.
과성장 농작물 어떻게 수확하나요?,맨손이나 도구로 블럭을 캐듯이 과성장 농작물을 캐시면 됩니다.
과성장 농작물이 안 캐져요,맨손이나 도구로 블럭을 캐듯이 과성장 농작물을 캐시면 됩니다.
요리 어떻게 해요?,/스폰의  베케아 가구 상점 에서 요리가구를 구매하여 제작할수 있습니다.
요리 할 수 있나요?,/스폰의  베케아 가구 상점 에서 요리가구를 구매하여 제작할수 있습니다.
요리 어디서 사요?,/스폰의  베케아 가구 상점 에서 요리가구를 구매하여 제작할수 있습니다.
요리 가구 어디서 사요?,/스폰의  베케아 가구 상점 에서 요리가구를 구매하여 제작할수 있습니다.
낚시 어디서 해요?,"어디서나 낚시를 할 수 있으며, 미끼를 장착해서 서버만의 커스텀 물고기를 낚을 수 있습니다."
낚시터가 따로 있나요?,"어디서나 낚시를 할 수 있으며, 미끼를 장착해서 서버만의 커스텀 물고기를 낚을 수 있습니다."
마을에서 낚시해도 돼요?,"어디서나 낚시를 할 수 있으며, 미끼를 장착해서 서버만의 커스텀 물고기를 낚을 수 있습니다."
야생에서 낚시해도 돼요?,"어디서나 낚시를 할 수 있으며, 미끼를 장착해서 서버만의 커스텀 물고기를 낚을 수 있습니다."
레드스톤회로 사용해도 되나요?,"비교기,중계기,끈끈이피스톤,관측기,상자실린수레를 이용한 자동회로는 금지합니다./위키 > 규칙을 참고 부탁드립니다."
레드스톤회로 금지인가요?,"비교기,중계기,끈끈이피스톤,관측기,상자실린수레를 이용한 자동회로는 금지합니다./위키 > 규칙을 참고 부탁드립니다."
자동 공장 만들어도 되나요?,"비교기,중계기,끈끈이피스톤,관측기,상자실린수레를 이용한 자동회로는 금지합니다./위키 > 규칙을 참고 부탁드립니다."
자동 회로 공장 만들 수 있나요?,"비교기,중계기,끈끈이피스톤,관측기,상자실린수레를 이용한 자동회로는 금지합니다./위키 > 규칙을 참고 부탁드립니다."
지옥은 랜덤텔포가 안되나요?,"네, 네더월드와 엔더월드는 랜덤텔포가 불가능합니다."
서버 입장이 안돼요,현재 해당 서버의 인원이 가득 차 서버 입장이 안 되는 상황이기에 계속해서 접속시도를 하시다보면 접속할 수 있습니다.
혹시 상점에 팔 때 수수료가 있나요?,"네, 상점에 판매할 때 5%의 수수료가 발생해서 (판매 금액x0.95)코인 만큼 획득하게 됩니다."
일퀘중에 농작물 수확하기에서 커스텀은 포함이 안되나요?,"네, 커스텀 농작물은 포함이 안되고 밀, 비트, 감자, 당근, 네더와트 등의 씨앗 작물만 포함 됩니다."
여기 인첸트 테이블이 있는곳 있나요?,/스폰 > 우측 버스정류장 > 마법부여소에서 인챈트를 하시거나 마을에서 인챈트장을 만들어서 사용하면 됩니다.
물뿌리개랑 스프링쿨러는 어떻게 업글하나요?,/스폰 > 우측 버스정류장 > 하버의 농작물상점의 npc에게 교환할 수 있습니다.
vip되는 방법이 뭔가요?,/후원 에서 로얄젤리 20개로 vip 칭호 30일 이용권을 구매할 수 있습니다.
나무는 어디서 캐죠?,"/워프 > 야생월드 를 통해 이동 후, /wild 를 통해 랜덤텔포 하면서 나무를 캐면 됩니다."
스프링 쿨러 제작은 불가능한가요?,"네, 스프링쿨러는 /상점 에서 구매하거나 유저에게 구매해야 합니다."
바닐라 농사는 청크제한이 없나요?,"네, 바닐라 농사는 따로 제한하고 있지 않습니다."
비료 중복적용이 되나요?,"아니오, 마지막에 뿌린 비료의 효과만 적용되고 이전에 뿌린 비료의 효과는 사라집니다."
야생에서 셜커상자가 설치된 위치를 까먹었어요,셜커상자를 설치 후 잠금을 하셨다면 /cp > 잠금목록 > 셜커상자 를 통해 잠금된 블럭의 위치를 찾을 수 있습니다.
vip 칭호는 어떻게 얻어요?,/후원 에서 로얄젤리 20개로 vip 칭호 30일 이용권을 구매할 수 있습니다.
겨울은 며칠까지 있나요?,"봄, 여름, 가을, 겨울 4계절이 존재하며 계절마다 28일까지 있습니다."
마을 청크를 늘리려면 마을을 다시 생성해야 하나요?,기존에 구매한 마을청크 옆의 황무지 청크에서 /claim 를 통해 마을 청크를 추가로 구매하면 됩니다.
과성장 하는 것들은 다 자란 상태에서 일정시간이 지나면 과성장하나요?,비료를 사용하지 않을 경우 커스텀 농작물이 완전히 성장할 때 1% 확률로 과성장 농작물이 나옵니다.
행운의 미끼 효과가 뭔가요?,확률적으로 마인크래프트 '행운' 버프를 주는 효과입니다. 
은행이 어디있어요?,/상점 > 좌측상단에서 이용 가능 합니다.
먼 곳 몬스터까지 어떻게 보나요?,서버자체적으로 ntt 시야 거리가 짧게 설정돼 있어서 조절은 불가능합니다.
마을 어케가나요?,/서버이동 마을서버 를 통해 갈 수 있습니다.
마을1에 만들고 마을2에도 만들 수 있나요?,"네, 각 마을서버마다 마을 가입이 가능합니다."
상자 어떻게 잠궈요?,/잠금설정 를 입력 후 상자를 좌클릭 하면 됩니다.
잠근은 어떻게 푸나요?,/잠금해제 를 입력 후 상자를 좌클릭 하면 됩니다.
이거 시즌패스 뭔가요?,"길라잡이 50단계 이상부터 해금되는 기능으로 일퀘, 주간퀘를 클리어하여 시즌패스 점수를 얻고 시즌패스 레벨을 올려 보상을 받을 수 있습니다."
아무 물고기나 손질 할수있어요?,물고기 손질은 커스텀 물고기만 가능합니다.
낚시대회 말고는 일일랭킹 점수 얻는 방법 없을까요?,"일일랭킹 점수는 낚시대회 참가, 레이드, 보물상자 최초 발견시 획득이 가능하며 스킬 활동을 할 때(ex: 블럭 캐기, 농작물 캐기 등) 1% 확률로 일일랭킹 점수 1점을 얻을 수 있습니다."
마법은 스킬 어떻게 올려요?,/스킬 > 해당 스킬 > 돋보기 아이콘에서 자세한 경험치 획득법 및 경험치량을 볼 수 있습니다.
농사 레벨 어캐 올리나요?,/스킬 > 해당 스킬 > 돋보기 아이콘에서 자세한 경험치 획득법 및 경험치량을 볼 수 있습니다.
농사 레벨 빨리 올리는 방법이 없나요?,농사 레벨이 낮을 때는 바다에서 해초를 캐거나 대나무를 캐는 것을 추천드립니다.
벌 포획할 수 있는 방법이 있나요?,벌이 벌통으로 들어갔을 때 섬세한 손길 도구로 벌통을 캐면 됩니다.
씨앗 어디서 구하나요?,/상점 > 잡화상점 > 농사 상점 > 씨앗 상점 에서 구매가 가능합니다.
혹시 손에 횃불 들면 안 밝아지나요?,옵티파인 설치 후 esc > 비디오설정 > 동적조명 on 으로 설정해야 합니다.
마을 확장할때쓰는 금괭이 얻는 명령어가 뭔가요?,마을 월드에서 /selection 를 통해 사용할 수 있습니다.
스프링쿨러 업그레이드 어떻게 하나요?,/스폰 > 우측 버스정류장 > 하버의 농작물상점의 npc에게 교환할 수 있습니다.
지옥문 만들었는데도 네더월드로 안가져요,"네더월드는 길라잡이 20단계 이상을 클리어한 유저가 야생월드에서 지옥포탈을 통해 갈 수 있습니다. 길라잡이 20단계 이상을 클리어 했는 지, 현재 서버가 야생월드가 맞는지 확인 부탁드립니다."
어부 레벨은 스킬레벨 포함 아닌가요?,"네, 어부 레벨은 스킬의 '낚시' 레벨과 별개입니다."
커스텀 작물 괭이로 캐면 행운 적용 되나요?,"아니오, 커스텀 작물은 행운, 스킬이 적용되지 않습니다."
잠수 명령어가 따로 있나요?,/서버이동 > > 로비서버 > 네더의 별 우클릭 > 잠수전투 를 하시면 베어코인으로 교환 가능한 점수를 얻으며 잠수가 가능합니다.
마을 y좌표 제한있나요?,마인크래프트 건축 한계와 같습니다.
금괭이 소환 명령어뭔가요?,마을 월드에서 /selection 를 통해 사용할 수 있습니다.
플라이 어떻게 쓰나요?,길라잡이를 15단계 이상으로 진행한 후 마을 월드에서 /fly 를 통해 사용 가능합니다. 야생에서는 사용이 불가능합니다.
원소 정수는 어디에 쓰나요?,추후 원소 업데이트 후에 사용처가 추가될 예정이니 모으고 계시는 것을 추천드립니다.
과성장은 어떻게 생기는건가요?,비료를 사용하지 않을 경우 커스텀 농작물이 완전히 성장할 때 1% 확률로 과성장 농작물이 나옵니다.
커농은 일퀘 수확카운트에 안속하나요?,"네, 일퀘 및 주간퀘 '작물 수확' 횟수에 커스텀 농작물과 수박, 호박, 사탕수수 등은 포함이 안되고 밀, 비트, 감자, 당근, 네더와트 등의 씨앗 작물만 포함 됩니다."
원소가루는 어따가 쓰나요?,추후 원소 업데이트 후에 사용처가 추가될 예정이니 모으고 계시는 것을 추천드립니다.
드워프는 어디서 얻을 수 있어요?,"/보급상자 > 열쇠상인에게 토르, 큐피트, 드워프 열쇠 구매 후 상자를 개봉하거나 유저한테 구매할 수 있습니다."
번개 모양은 뭔가요?,"스태미너라는 수치로 야생에서 상자를 열 때 20~50 씩 소모 되고, 가득 차 있어도 디버프는 없습니다."
마을 최대 구매 갯수는 몇개인가요?,"기본적으로 9청크까지 구매가 가능합니다. 길라잡이 45단계 이후, 대장장이 작업대 건축자재를 통해 청크를 늘릴 수 있으며 본인이 점유한 땅과 붙혀서 땅을 점유 할 수 있습니다."
과성장 농작물 하루에 몇번 팔 수 있어요?,모든 과성장 농작물은 하루에 10개의 판매제한이 존재합니다.
원소는 어디다 쓰나요?,추후 원소 업데이트 후에 사용처가 추가될 예정이니 모으고 계시는 것을 추천드립니다.
셋홈은 두개가 최대인가요?,"네, 모든 서버를 통틀어서 2개의 셋홈을 가질 수 있습니다."
레이드 보상 개인 지급인가요?,"네, 보상은 /레이드 에 적힌 보상이 레이드에 참여한 모두에게 개인적으로 지급됩니다."
네더월드는 랜덤 이동 기능이 없나요?,"네, 네더월드, 엔더월드에서는 /wild 를 통한 랜덤텔포가 불가능합니다."
마을비 얼마나 나가는지 어떻게 확인하나요?,/마을 > 마을 정보(인챈트 북 형태) > 세금(빨간 글씨) 확인 하면 됩니다.
마을 생성이 안 돼요,"마을 1, 2 서버는 현재 생성제한이라 마을 생성이 불가능하고 마을 3서버에서 생성하시면 됩니다. /wild 를 통해 주변에 마을이 없는 공간을 찾아보시는걸 추천드려요."
원소가루로 조각을 만들 수 있나요?,"아니오, 현재 시스템 상으로는 불가능합니다."
과성장 농작물은 다 자란 상태에서 또 기다려야 하나요?,비료를 사용하지 않을 경우 커스텀 농작물이 완전히 성장할 때 1% 확률로 과성장 농작물이 나옵니다.
경험치 레벨은 어디다 쓰나요?,/e 를 통해 바닐라 경험치를 소비해 커스텀 인챈트를 뽑을 수 있습니다.
과성장 촉진제는 농작물 심어놓고 뿌려야 하는건가요?,"아니오, 비료는 항상 작물을 심기 전에 화분에 사용해야 합니다."
바다의 심장은 어디에 쓰이나요?,전달체 조합이나 낚싯대 강화석 중 하나인 'Master fisherman' 제작에 쓰입니다.
장비 수리 돈드나요?,서버내에 수리 명령어는 따로 존재하지 않습니다. 모루나 수선 인챈트를 통해 장비를 수리할 수 있습니다.
비료는 한 화분에 여러 종류 중첩 사용 가능한가요?,"아니오, 마지막에 뿌린 비료의 효과만 적용되고 이전에 뿌린 비료의 효과는 사라집니다."
자신의 잠수코인은 어디서 확인하나요?,잠수 전투내에 있는 알레이 npc를 통해서 확인할 수 있습니다.
금 물뿌리개는 어디서 구할 수 있나요?,/스폰 > 우측 버스정류장 > 하버의 농작물상점의 npc에게 교환할 수 있습니다.
동전은 어디서 교환하나요?,/상점 > 은행에서 교환할 수 있습니다.
가구는 어디서 구매하나요?,/스폰 > 우측버스정류장 > 가구 상점 에서 구매가 가능합니다.
마을 어떻게 삭제하나요?,삭제하고자 하는 마을이 있는 마을월드에서 /마을 삭제 를 하면 됩니다.
마을월드에선 랜덤티피 안되나요?,랜덤 TP 명령어는 /wild 로 이용 가능합니다.
과성장 작물은 어디에다 쓰나요?,/상점 > 잡화상점 > 농사 상점 >과성장 농작물 판매 를 통해 꿀을 얻을 수 있습니다.
은행에서 코인 바꾸기가 안되는데 어떻게 하는건가요?,/상점 > 우측 상단 은행에서 코인을 구매하거나 판매할 수 있습니다.
스프링쿨러에 물줘도 안뿌리는데 왜이러나요?,스프링쿨러는 매일 정해진 시간(화분이 마른 직후)마다 물을 뿌립니다. 
스폰포인트 재설정 어떻게 하나요?,본인의 마을에서 /land setspawn 를 통해 마을 스폰위치를 재설정 할 수 있습니다.
황금토마토는 어디에 쓰는건가요?,추후에 업데이트를 통해 사용처가 추가될 예정입니다.
커스텀 농사로 농사스킬 올라가요?,"네, 커스텀 농작물을 수확할 때도 농사 스킬 경험치가 올라갑니다."
경매장 아이템 구매했는데 어떻게 받나요?,경매장에 있는 '구입한 아이템' 항목에서 받을 수 있습니다.
비닐하우스 한개가 화분 하나만 적용되는 건가요?,"네, 비닐하우스 한 개당 화분 한 개만 보호할 수 있습니다."
마을 청크 어떻게 늘리나요?,"길라잡이 45단계 이후, 대장장이 작업대 건축자재를 통해 마을 최대 청크를 늘릴 수 있습니다."
처음 들어왔는데 뭐 부터 해야할지 모르겠어요,/위키 를 한 번 정독한 후 /길라잡이 를 따라 플레이 하는걸 추천드립니다.
예금 어떻게 빼나요?,/마을 출금 금액 를 통해 가능합니다.
자신 엔트로피는 어디서 확인할 수 있어요?,/fish entropy 를 통해 확인이 가능합니다.
집 어케 가나요?,본인의 마을이 있는 마을월드에서 /마을 스폰 를 통해 갈 수 있습니다.
마을 어디서 사여?,마을월드에서 /마을 생성 마을이름 를 통해 마을을 생성할 수 있습니다.
고급 스프링쿨러는 경매에서 밖에 못 얻나요?,/스폰 > 우측 버스정류장 > 하버의 농작물상점의 npc에게 교환할 수 있습니다.
야생초기화 언제 해요?,야생 초기화는 약 2주마다 진행됩니다. 자세한 야생 초기화 날짜는 초기화 며칠 전 디스코드 공지사항에 공지 됩니다.
최첨단 스프링쿨러 범위가 어떻게 되나요?,스프링 쿨러가 설치된 칸을 포함해서 7x7 범위로 물을 뿌려줍니다.
꿀이 든 병 어떻게 꿀병으로 바꾸나요?,서로 다른 아이템이기에 불가능합니다.
커스텀 인챈트 칸은 어떻게 늘리나요?,/스폰 > 우측 버스정류장 > 마법부여소의 마법 조수에게서 마법의 눈을 구매해 사용하면 됩니다.
날짜는 언제마다 바뀌나요?,"마인크래프트로 하루, 현실시간으로 20분마다 바뀝니ㅏㄷ."
채팅창 크기를 조절할 수 있나요?,esc > 설정 > 비디오설정 > gui 크기설정 을 통해 조절 할 수 있습니다.
잠수 포인트로는 뭘 할수 있나요?,잠수 전투내에 있는 알레이 npc를 통해 잠수전투 스텟을 올리거나 베어코인으로 교환 후 /상점 > 잠수상점 에서 아이템을 구매할 수 있습니다.
혹시 피로도는 어떻게 채우나요?,1분이 지날때마다 자동으로 1씩 채워집니다.
엔트로피 어떻게 뽑나요?,길라잡이 35단계 이후로 /어부 > 낚싯대강화 > 엔트로피추출 를 통해 엔트로피 결정으로 교환이 가능합니다.
돈이있는데 물뿌리개랑 스프링쿨러가 왜 안사지나요?,"스프링쿨러, 물뿌리개 등은 '꿀' 을 통해서 구매할 수 있습니다."
대기열 취소 어떻게 하나요?,/leavequeue 를 통해 대기열 취소가 가능합니다.
연금술 경험치 어떻게 올려요?,/스킬 > 해당 스킬 > 돋보기 아이콘에서 자세한 경험치 획득법 및 경험치량을 볼 수 있습니다.
경매에 올린 거 수령 어떻게 하나요?,/경매 수령 를 통해 판매금액 수령이 가능합니다.
실 어디서 사나요?,/상점 > 잡화상점 > 전리품 상점 에서 구매 가능합니다.
색 안변하는 화분은 어떻게 해야하나요?,화분을 부수고 다시 설치하시면 됩니다.
은 물뿌리개나 은 스프링쿨러는 어떻게 구하나요?,/스폰 > 우측 버스정류장 > 하버의 농작물상점의 npc에게 교환할 수 있습니다.
마을 유지비는 뭔가요?,현실 시간으로 매일 자정 마을 금고에서 자동으로 (청크x2500)코인 만큼의 마을 유지비가 빠져나갑니다. 마을 금고에 마을 유지비가 없으면 마지막으로 점유한 청크부터 부족한 유지비의 가격만큼 사라집니다.
다른 플레이어에게 제가 가지고있는 엔트로피 줄수있는 방법있나요?,길라잡이 35단계 이후로 /어부 > 낚싯대강화 > 엔트로피추출 를 통해 엔트로피 결정으로 교환이 가능합니다.
커스텀 농사는 어떻게 채집하나요?,커스텀 농작물이 다 자란 상태일 경우 맨손으로 우클릭을 해서 수확할 수 있습니다.
엔더월드 어떻게 가나요?,길라잡이 60단계를 클리어한 상태에서 야생에서 엔더포탈을 찾아서 들어가면 됩니다.
개인 창고같은거 없나요,길라잡이 40단계 이후로 /가방 를 통해 가방1줄(9칸)씩 사용이 가능하고 60단계 까지 클리어할 경우 3줄(27칸) 사용 가능합니다.
꿀로 뭘 할 수 있나요?,"[/상점 > 꿀 상점, 하버의 농작물 상점], [/e > 마법 상점], [/스폰 > 우측버스정류장 > 가구 상점, 악기 상점] 등에서 각종 아이템을 구매하는데 사용합니다."
수선 어디서 사나요?,/상점 > 잡화상점 > 기타상점에서 30만 코인에 구매 가능합니다.
금괭이 얻는 명령어가 뭔가요?,마을 월드에서 /selection 를 통해 사용할 수 있습니다.
본인의 엔트로피 소지량은 어떻게 볼 수 있나요?,/fish entropy 를 통해 확인이 가능합니다.
비닐하우스 능력이 뭔가요?,비닐하우스로 보호 받는 화분에 계절에 상관없이 작물을 심을 수 있습니다.
코인 어떻게 모아요?,/상점 에 아이템을 판매하거나 유저거래를 통해 코인을 벌 수 있습니다. 초반에는 광질을 하시는 것을 추천 드립니다.
물약을 만들어도 연금술 레벨이 안올라요,본인이 설치한' 양조기에 물약을 제조하셔야 경험치가 오릅니다.
장비에 커스텀 인챈트 몇 개 까지 가능한가요?,"기본적으로는 2개까지 붙일 수 있고, 마법의 눈을 사용하면 최대 8개까지 붙일 수 있습니다."
낚시레벨 순위 어디서 보나요?,/skill top 스킬이름 을 통해 스킬순위를 볼 수 있습니다.
동물은 어디서 찾아요?,/wild 를 통해 랜덤텔포 하며 평원이나 자작나무 숲 지형등을 찾은 후 f3+b 로 히트박스를 키고서 동물을 찾으시면 됩니다.
큐피트 도구가 뭔가요?,베어 타운에 존재하는 특수한 장비 입니다.
큐피트 도구 어디서 얻어요?,"/보급상자 > 열쇠상인에게 토르, 큐피트, 드워프 열쇠 구매 후 상자를 개봉하거나 유저한테 구매할 수 있습니다."
작물 수확 퀘스트 어떻게 깨나요?,"커스텀 농작물은 퀘스트 진행도에 포함이 안되고 밀, 비트, 감자, 당근, 네더와트 등의 씨앗 작물을 캐서 진행도를 올릴 수 있습니다."
로얄젤리 주 사용처가 어떻게 되나요?,"마을 건축자재, vip구매, (드워프, 큐피트) 열쇠 및 패키지 구매 등에 사용합니다."
